{
  "activityName": "Tomato, cherry, consumption mix, organic 2025 {FR} U",
  "categories": [
    "ingredient",
    "material",
    "material_type:fruits_and_vegetables"
  ],
  "displayName": "Tomates cerises Bio",
  "id": "1c06d328-cbf8-5c9c-8063-612d7cf6e79e",
  "location": "FR",
  "metadata": [
    {
      "alias": "cherry-tomato-organic",
      "cropGroup": "LEGUMES-FLEURS",
      "cropGroupMatch": {
        "confidence": 1.0,
        "rule": "matched 'tomato' in cropgroup.csv"
      },
      "defaultOrigin": "France",
      "displayName": "Tomates cerises Bio",
      "id": "1ffee0b5-720d-53b0-b594-19e08a1860a3",
      "inediblePart": 0.03,
      "inediblePartMatch": {
        "confidence": 0.95,
        "rule": "Matched with Tomatoes in agb_inedible.csv"
      },
      "ingredientCategories": [
        "vegetable_fresh",
        "organic"
      ],
      "ingredientDensity": 1.0,
      "ingredientDensityMatch": {
        "confidence": 0.95,
        "rule": "Matched with tomato in density.csv"
      },
      "rawToCookedRatio": 0.856,
      "rawToCookedRatioMatch": {
        "confidence": 1.0,
        "rule": "vegetable default from food_type_cooked_to_raw.csv"
      },
      "scenario": "organic",
      "scopes": [
        "food",
        "food2"
      ],
      "transportCooling": "always",
      "transportCoolingMatch": {
        "confidence": 1.0,
        "rule": "vegetable NOVA 1 → always (perishable)"
      },
      "visible": true
    }
  ],
  "scopes": [
    "food",
    "food2"
  ],
  "source": "Ginko 2025",
  "unit": "kg"
}
