{
  "activityName": "Cocoa butter, at plant {RER} - Adapted from WFLDB U",
  "categories": [
    "ingredient",
    "material",
    "material_type:other_food_items"
  ],
  "displayName": "Beurre de cacao UE",
  "id": "e959ac4d-1b20-59cd-a2f3-44f11703a015",
  "metadata": [
    {
      "alias": "cocoa-butter-eu-2025",
      "cropGroup": "FRUITS A COQUES",
      "defaultOrigin": "EuropeAndMaghreb",
      "displayName": "Beurre de cacao UE (2025)",
      "id": "7b508b8e-7f3c-4ba4-93bc-4d11e5477dbe",
      "inediblePart": 0,
      "ingredientCategories": [
        "nut_oilseed_processed"
      ],
      "ingredientDensity": 0.447,
      "rawToCookedRatio": 1.0,
      "scenario": "import",
      "scopes": [
        "food",
        "food2"
      ],
      "transportCooling": "once_transformed",
      "visible": true
    },
    {
      "alias": "cocoa-butter-fr-2025",
      "cropGroup": "FRUITS A COQUES",
      "defaultOrigin": "OutOfEuropeAndMaghreb",
      "displayName": "Beurre de cacao par défaut (2025)",
      "id": "0ea5f5a0-51d9-41da-9ac4-cb60f3ddb86c",
      "inediblePart": 0,
      "ingredientCategories": [
        "nut_oilseed_processed"
      ],
      "ingredientDensity": 0.447,
      "rawToCookedRatio": 1.0,
      "scenario": "import",
      "scopes": [
        "food",
        "food2"
      ],
      "transportCooling": "once_transformed",
      "visible": true
    }
  ],
  "scopes": [
    "food",
    "food2"
  ],
  "source": "Agribalyse 3.2"
}
