{
  "activityName": "Raspberry, at farm, organic 2025 {RS}",
  "categories": [
    "ingredient",
    "material",
    "material_type:fruits_and_vegetables"
  ],
  "displayName": "Framboise Bio (2025)",
  "id": "3bd75842-f9d9-55d8-8506-e6ea53be8495",
  "location": "RS",
  "metadata": [
    {
      "alias": "raspberry-organic-2025",
      "cropGroup": "LEGUMES-FLEURS",
      "defaultOrigin": "EuropeAndMaghreb",
      "displayName": "Framboise Bio (2025)",
      "explain": "icv bio = icv RS Gingko",
      "id": "091cda9d-3c9d-444c-ad0e-1d6f34491767",
      "inediblePart": 0.03,
      "ingredientCategories": [
        "vegetable_fresh",
        "organic"
      ],
      "ingredientDensity": 0.447,
      "rawToCookedRatio": 0.856,
      "scenario": "organic",
      "scopes": [
        "food",
        "food2"
      ],
      "transportCooling": "always",
      "visible": true
    },
    {
      "alias": "raspberry-organic",
      "cropGroup": "VERGERS",
      "cropGroupMatch": {
        "confidence": 1.0,
        "rule": "matched 'orange' in cropgroup.csv"
      },
      "defaultOrigin": "France",
      "displayName": "Framboise Bio",
      "id": "ab97a5eb-d29c-5bb0-a2e7-d0aa2e719808",
      "inediblePart": 0.03,
      "inediblePartMatch": {
        "confidence": 0.95,
        "rule": "Matched with Raspberries in agb_inedible.csv"
      },
      "ingredientCategories": [
        "vegetable_fresh",
        "organic"
      ],
      "ingredientDensity": 0.9,
      "ingredientDensityMatch": {
        "confidence": 1.0,
        "rule": "raspberry found in density.csv"
      },
      "rawToCookedRatio": 0.856,
      "rawToCookedRatioMatch": {
        "confidence": 1.0,
        "rule": "Matched with raspberry in cooked_to_raw.csv"
      },
      "scenario": "organic",
      "scopes": [
        "food",
        "food2"
      ],
      "transportCooling": "always",
      "transportCoolingMatch": {
        "confidence": 1.0,
        "rule": "fruit NOVA 1 → always (perishable)"
      },
      "visible": true
    }
  ],
  "scopes": [
    "food",
    "food2"
  ],
  "source": "Ginko 2025"
}
