{
  "activityName": "European Pilchard, Sardina pilchardus, BBiscay, Seine, average, at landing {FR} U",
  "categories": [
    "ingredient",
    "material",
    "material_type:other_food_items"
  ],
  "displayName": "Sardine FR (2025)",
  "id": "4e689c0a-009d-5798-b31b-f04357f2b724",
  "metadata": [
    {
      "alias": "sardine-fr-2025",
      "defaultOrigin": "France",
      "displayName": "Sardine FR (2025)",
      "id": "3a892ff6-4689-4053-96e7-0f9038894fae",
      "inediblePart": 0.2,
      "ingredientCategories": [
        "animal_product"
      ],
      "ingredientDensity": 1.0,
      "rawToCookedRatio": 1.0,
      "scenario": "reference",
      "scopes": [
        "food",
        "food2"
      ],
      "transportCooling": "always",
      "visible": true
    }
  ],
  "scopes": [
    "food",
    "food2"
  ],
  "source": "Agribalyse 3.2"
}
