{
  "activityName": "Oats, at farm {GLO} - Adapted from WFLDB U",
  "categories": [
    "ingredient",
    "material",
    "material_type:other_food_items"
  ],
  "displayName": "Avoine par défaut",
  "id": "786a7e5d-e48c-5989-8c31-bd49aabab932",
  "metadata": [
    {
      "alias": "oats-glo-2025",
      "cropGroup": "AUTRES CEREALES",
      "defaultOrigin": "OutOfEuropeAndMaghreb",
      "displayName": "Avoine par défaut (2025)",
      "explain": "",
      "id": "94c4be9e-452d-4870-b1a2-5d2404a0490b",
      "inediblePart": 0,
      "ingredientCategories": [
        "grain_raw"
      ],
      "ingredientDensity": 0.72,
      "rawToCookedRatio": 2.259,
      "scenario": "import",
      "scopes": [
        "food",
        "food2"
      ],
      "transportCooling": "none",
      "visible": false
    },
    {
      "alias": "oats-ue-2025",
      "cropGroup": "AUTRES CEREALES",
      "defaultOrigin": "EuropeAndMaghreb",
      "displayName": "Avoine UE (2025)",
      "id": "6c3815da-dec2-4cf2-9be6-9d99b4e9948d",
      "inediblePart": 0,
      "ingredientCategories": [
        "grain_raw"
      ],
      "ingredientDensity": 1.0,
      "rawToCookedRatio": 2.259,
      "scenario": "import",
      "scopes": [
        "food",
        "food2"
      ],
      "transportCooling": "none",
      "visible": false
    }
  ],
  "scopes": [
    "food",
    "food2"
  ],
  "source": "Agribalyse 3.2"
}
