{
  "activityName": "Pasta, dried, from durum wheat, at plant, from GLO wheat and ES elec",
  "categories": [
    "ingredient",
    "material",
    "material_type:other_food_items"
  ],
  "displayName": "Pâtes ES (blé GLO + élec ES) (2025)",
  "id": "2d0ef86b-3865-57f9-a896-e45c8f680b2c",
  "metadata": [
    {
      "alias": "pasta-glo-es",
      "cropGroup": "BLE TENDRE",
      "defaultOrigin": "EuropeAndMaghreb",
      "displayName": "Pâtes ES (blé GLO + élec ES)",
      "explain": "Pâtes avec blé GLO et transformation élec ES",
      "id": "9bead6d1-5941-40b0-ae58-3d51bb690ba8",
      "inediblePart": 0.2,
      "ingredientCategories": [
        "grain_processed"
      ],
      "ingredientDensity": 0.72,
      "rawToCookedRatio": 2.259,
      "scenario": "import",
      "scopes": [
        "food",
        "food2"
      ],
      "transportCooling": "none",
      "visible": true
    }
  ],
  "scopes": [
    "food",
    "food2"
  ],
  "source": "Ecobalyse"
}