{
  "activityName": "Polyethylene, high density, granulate {RER}| production | Cut-off, S - Copied from Ecoinvent U",
  "categories": [
    "packaging"
  ],
  "displayName": "Polyéthylène haute densité",
  "id": "174ad4a0-c386-5a34-abba-c7cc1839701b",
  "metadata": [
    {
      "id": "77d32048-2678-4942-bf52-0eb150dab3f9",
      "scopes": [
        "food2"
      ]
    }
  ],
  "scopes": [
    "food",
    "food2"
  ],
  "source": "Agribalyse 3.2"
}