{
  "categories": [
    "transformation",
    "material_type:wood"
  ],
  "comment": "Energy consumptions based on Ecobalyse litterature review with an average scenario hypothesis (main sources : FAO national statistics  + Swedish manufacturing plants statistics  + Canada manufacturing plants statistics + Ecoinvent resources)",
  "displayName": "Sciage + séchage au four (bois)",
  "elecMJ": 216,
  "heatMJ": 1000,
  "id": "9154831a-090d-5636-81d3-ca89b8af20d2",
  "impacts": {
    "acd": 0,
    "cch": 0,
    "etf": 0,
    "etf-c": 0,
    "fru": 0,
    "fwe": 0,
    "htc": 0,
    "htc-c": 0,
    "htn": 0,
    "htn-c": 0,
    "ior": 0,
    "ldu": 0,
    "mru": 0,
    "ozd": 0,
    "pco": 0,
    "pma": 0,
    "swe": 0,
    "tre": 0,
    "wtu": 0
  },
  "metadata": [
    {
      "id": "baf8cc1a-767e-452d-b86e-e9399a99cb55",
      "scopes": [
        "object",
        "veli"
      ]
    }
  ],
  "scopes": [
    "object",
    "veli"
  ],
  "source": "Custom",
  "unit": "m3",
  "waste": 0.5
}