{
  "activityName": "Pineapple, at farm, organic 2025 {CR}",
  "categories": [
    "ingredient",
    "material",
    "material_type:fruits_and_vegetables"
  ],
  "displayName": "Ananas Bio (CR)",
  "id": "1b151f8c-d72b-5e6a-837c-ac4eb4b341a6",
  "location": "CR",
  "metadata": [
    {
      "alias": "pineapple-organic",
      "cropGroup": "ARBORICULTURE",
      "cropGroupMatch": {
        "confidence": 1.0,
        "rule": "matched 'pineapple' in cropgroup.csv"
      },
      "defaultOrigin": "France",
      "displayName": "Ananas Bio",
      "id": "c52c5693-d7b8-53ff-ba1e-5a0fa6e153a2",
      "inediblePart": 0.5,
      "inediblePartMatch": {
        "confidence": 1.0,
        "rule": "Matched with Pineapple in agb_inedible.csv"
      },
      "ingredientCategories": [
        "vegetable_fresh",
        "organic"
      ],
      "ingredientDensity": 0.95,
      "ingredientDensityMatch": {
        "confidence": 1.0,
        "rule": "pineapple found in density.csv"
      },
      "rawToCookedRatio": 0.856,
      "rawToCookedRatioMatch": {
        "confidence": 1.0,
        "rule": "Matched with pineapple in cooked_to_raw.csv"
      },
      "scenario": "organic",
      "scopes": [
        "food",
        "food2"
      ],
      "transportCooling": "always",
      "transportCoolingMatch": {
        "confidence": 1.0,
        "rule": "fruit NOVA 1 → always (perishable)"
      },
      "visible": true
    }
  ],
  "scopes": [
    "food",
    "food2"
  ],
  "source": "Ginko 2025",
  "unit": "kg"
}
